{
    "$schema": "http://json-schema.org/draft-07/schema#",
    "type": "object",
    "properties": {
        "title": {
            "type": "string",
            "description": "The title of the course."
        },
        "description": {
            "type": "string",
            "description": "A short description of the course."
        },
        "language": {
            "type": "string",
            "description": "The primary language of the course."
        },
        "targetLanguage": {
            "type": "string",
            "description": "The language being taught in the course."
        },
        "author": {
            "type": "string",
            "description": "The name of the course creator."
        },
        "version": {
            "type": "string",
            "description": "Versioning for tracking updates to the course."
        },
        "createdAt": {
            "type": "string",
            "pattern": "^\\d{4}-\\d{2}-\\d{2}T\\d{2}:\\d{2}:\\d{2}Z$",
            "description": "Timestamp when the course was created."
        },
        "updatedAt": {
            "type": "string",
            "pattern": "^\\d{4}-\\d{2}-\\d{2}T\\d{2}:\\d{2}:\\d{2}Z$",
            "description": "Timestamp of the last course update."
        },
        "tags": {
            "type": "array",
            "items": {
                "type": "string"
            },
            "description": "Keywords related to the course for searching and categorization."
        },
        "lessons": {
            "type": "array",
            "items": {
                "type": "object",
                "properties": {
                    "title": {
                        "type": "string"
                    },
                    "description": {
                        "type": "string"
                    },
                    "cards": {
                        "type": "array",
                        "items": {
                            "oneOf": [
                                {
                                    "type": "object",
                                    "properties": {
                                        "class": {
                                            "type": "string",
                                            "enum": [
                                                "vocab"
                                            ]
                                        },
                                        "qlang": {
                                            "type": "string",
                                            "enum": [
                                                "default",
                                                "target"
                                            ]
                                        },
                                        "vocab": {
                                            "type": "object",
                                            "additionalProperties": {
                                                "type": "string"
                                            }
                                        }
                                    },
                                    "required": [
                                        "class",
                                        "qlang",
                                        "vocab"
                                    ]
                                },
                                {
                                    "type": "object",
                                    "properties": {
                                        "class": {
                                            "type": "string",
                                            "enum": [
                                                "dynamic-vocab"
                                            ]
                                        },
                                        "qlang": {
                                            "type": "string",
                                            "enum": [
                                                "default",
                                                "target"
                                            ]
                                        }
                                    },
                                    "required": [
                                        "class",
                                        "qlang"
                                    ]
                                },
                                {
                                    "type": "object",
                                    "properties": {
                                        "class": {
                                            "type": "string",
                                            "enum": [
                                                "multiple-choice"
                                            ]
                                        },
                                        "qlang": {
                                            "type": "string",
                                            "enum": [
                                                "default",
                                                "target"
                                            ]
                                        },
                                        "question": {
                                            "type": "string"
                                        },
                                        "answers": {
                                            "type": "array",
                                            "items": {
                                                "type": "string"
                                            }
                                        },
                                        "answer": {
                                            "type": "string"
                                        }
                                    },
                                    "required": [
                                        "class",
                                        "qlang",
                                        "question",
                                        "answers",
                                        "answer"
                                    ]
                                },
                                {
                                    "type": "object",
                                    "properties": {
                                        "class": {
                                            "type": "string",
                                            "enum": [
                                                "writing"
                                            ]
                                        },
                                        "qlang": {
                                            "type": "string",
                                            "enum": [
                                                "default",
                                                "target"
                                            ]
                                        },
                                        "question": {
                                            "type": "string"
                                        },
                                        "answer": {
                                            "type": "string"
                                        }
                                    },
                                    "required": [
                                        "class",
                                        "qlang",
                                        "question"
                                    ]
                                },
                                {
                                    "type": "object",
                                    "properties": {
                                        "class": {
                                            "type": "string",
                                            "enum": [
                                                "writing-blocks"
                                            ]
                                        },
                                        "qlang": {
                                            "type": "string",
                                            "enum": [
                                                "default",
                                                "target"
                                            ]
                                        },
                                        "question": {
                                            "type": "string"
                                        },
                                        "answer": {
                                            "type": "string"
                                        },
                                        "options": {
                                            "type": "array",
                                            "items": {
                                                "type": "string"
                                            }
                                        }
                                    },
                                    "required": [
                                        "class",
                                        "qlang",
                                        "question"
                                    ]
                                },
                                {
                                    "type": "object",
                                    "properties": {
                                        "class": {
                                            "type": "string",
                                            "enum": [
                                                "blanks"
                                            ]
                                        },
                                        "qlang": {
                                            "type": "string",
                                            "enum": [
                                                "default",
                                                "target"
                                            ]
                                        },
                                        "alang": {
                                            "type": "string",
                                            "enum": [
                                                "default",
                                                "target"
                                            ]
                                        },
                                        "question": {
                                            "type": "string"
                                        },
                                        "words": {
                                            "type": "array",
                                            "items": {
                                                "type": "object",
                                                "minProperties": 1,
                                                "maxProperties": 1,
                                                "additionalProperties": {
                                                    "type": "boolean"
                                                }
                                            }
                                        }
                                    },
                                    "required": [
                                        "class",
                                        "qlang",
                                        "question",
                                        "words"
                                    ]
                                }
                            ]
                        }
                    }
                },
                "required": [
                    "title",
                    "cards"
                ]
            }
        }
    }
}