{
    "title": "Sanskrit Alphabet Basics",
    "description": "An introduction to the Sanskrit alphabet, written in the Devanagari script.",
    "language": "en",
    "targetLanguage": "sa",
    "author": "ChatGPT",
    "version": "1.0",
    "createdAt": "2025-08-08T00:00:00Z",
    "updatedAt": "2025-08-08T00:00:00Z",
    "tags": [
        "language",
        "alphabet",
        "Sanskrit",
        "Devanagari"
    ],
    "lessons": [
        {
            "title": "Introduction to Devanagari",
            "description": "Learn the basic structure and sounds of the Sanskrit alphabet written in Devanagari script.",
            "cards": [
                {
                    "class": "multiple-choice",
                    "qlang": "default",
                    "question": "How many letters are there in the Sanskrit alphabet (Devanagari script)?",
                    "answers": [
                        "49",
                        "26",
                        "33",
                        "40"
                    ],
                    "answer": "49"
                },
                {
                    "class": "multiple-choice",
                    "qlang": "default",
                    "question": "What is the inherent vowel sound in each consonant of Devanagari script?",
                    "answers": [
                        "a",
                        "i",
                        "u",
                        "e"
                    ],
                    "answer": "a"
                },
                {
                    "class": "vocab",
                    "qlang": "default",
                    "vocab": {
                        "अ": "a (short vowel)",
                        "आ": "ā (long vowel)",
                        "इ": "i (short vowel)",
                        "ई": "ī (long vowel)",
                        "उ": "u (short vowel)",
                        "ऊ": "ū (long vowel)",
                        "ऋ": "ṛ (vocalic r)",
                        "ए": "e (dipthong)",
                        "ओ": "o (dipthong)"
                    }
                },
                {
                    "class": "vocab",
                    "qlang": "default",
                    "vocab": {
                        "क": "ka (guttural consonant)",
                        "ख": "kha",
                        "ग": "ga",
                        "घ": "gha",
                        "ङ": "ṅa"
                    }
                },
                {
                    "class": "multiple-choice",
                    "qlang": "default",
                    "question": "Which Devanagari letter represents the sound 'ka'?",
                    "answers": [
                        "क",
                        "ख",
                        "ग",
                        "च"
                    ],
                    "answer": "क"
                },
                {
                    "class": "writing",
                    "qlang": "default",
                    "question": "Write the Devanagari letter for the sound 'ga'.",
                    "answer": "ग"
                },
                {
                    "class": "blanks",
                    "qlang": "default",
                    "alang": "target",
                    "question": "Select the correct Devanagari letter for 'kha'.",
                    "words": [
                        {
                            "ख": true
                        },
                        {
                            "ग": false
                        },
                        {
                            "घ": false
                        }
                    ]
                }
            ]
        }
    ]
}